{
  "$schema": "./pattern.schema.json",
  "$comment": "ORC-016: a 1:1 transcription of the built-in Change template (state format 14). The service runs the two Checks steps itself; both skip while checks are off.",
  "id": "change",
  "name": "Change",
  "order": 10,
  "description": "Code change without interaction design: implement, checks, review, repair if needed, final checks, verify.",
  "whenToUse": "Most code changes: a fix you already understand, a refactor, a small feature without new screens or flows.",
  "steps": [
    {
      "id": "S1",
      "purpose": "Implement",
      "role": "coder",
      "dependsOn": [],
      "inputs": [],
      "outputs": [
        { "name": "change", "kind": "code-change" },
        { "name": "handoff", "kind": "handoff" }
      ]
    },
    {
      "id": "C1",
      "purpose": "Run the project's checks",
      "role": "checks",
      "dependsOn": ["S1"],
      "inputs": [{ "step": "S1", "output": "change" }],
      "outputs": [{ "name": "checks", "kind": "check-results" }],
      "checks": { "onFail": "findings" }
    },
    {
      "id": "S2",
      "purpose": "Code review",
      "role": "code_reviewer",
      "dependsOn": ["S1", "C1"],
      "inputs": [
        { "step": "S1", "output": "change" },
        { "step": "S1", "output": "handoff" },
        { "step": "C1", "output": "checks" }
      ],
      "outputs": [{ "name": "findings", "kind": "review-findings" }]
    },
    {
      "id": "S3",
      "purpose": "Repair review findings and failing checks",
      "role": "coder",
      "dependsOn": ["S2"],
      "inputs": [
        { "step": "S1", "output": "change" },
        { "step": "S2", "output": "findings" },
        { "step": "C1", "output": "checks" }
      ],
      "outputs": [{ "name": "change", "kind": "code-change" }],
      "runIf": [
        { "step": "C1", "output": "checks" },
        { "step": "S2", "output": "findings" }
      ],
      "iterate": { "from": "C1", "max": 3 }
    },
    {
      "id": "C2",
      "purpose": "Final checks",
      "role": "checks",
      "dependsOn": ["S3"],
      "inputs": [
        { "step": "S1", "output": "change" },
        { "step": "S3", "output": "change" }
      ],
      "outputs": [{ "name": "final", "kind": "check-results" }],
      "checks": { "onFail": "block" }
    },
    {
      "id": "S4",
      "purpose": "Verify and integrate",
      "role": "lead",
      "dependsOn": ["C2"],
      "inputs": [
        { "step": "S1", "output": "change" },
        { "step": "S3", "output": "change" },
        { "step": "S2", "output": "findings" },
        { "step": "C2", "output": "final" }
      ],
      "outputs": [{ "name": "verification", "kind": "verification" }]
    }
  ]
}
