{
  "$schema": "./pattern.schema.json",
  "id": "change-cross-review",
  "name": "Change, reviewed by the other provider",
  "order": 15,
  "description": "Change whose code review runs on the provider that did not write the change, whichever provider that was.",
  "whenToUse": "You want the code review done by the provider that did not write the change. A pin or a task role override on the review step still wins.",
  "extends": "change",
  "stepOverrides": {
    "S2": { "independentOf": "writer" }
  }
}
