{
  "$schema": "./pattern.schema.json",
  "$comment": "ORC-016: a 1:1 transcription of the built-in Goal template (state format 14). Large goals: plan a breakdown into child tasks (each runs its own pipeline in parallel), wait for them, then evaluate. The evaluation may break the remaining work down again, up to five rounds.",
  "id": "goal",
  "name": "Goal",
  "order": 60,
  "description": "Large goal: break it into parallel child tasks, evaluate, and iterate until the goal is met.",
  "whenToUse": "Work too large for one task.",
  "steps": [
    {
      "id": "S1",
      "purpose": "Plan the goal and break it into independent tasks",
      "role": "designer",
      "dependsOn": [],
      "inputs": [],
      "outputs": [{ "name": "plan", "kind": "breakdown" }]
    },
    {
      "id": "S2",
      "purpose": "Evaluate the finished tasks against the goal; list any remaining work",
      "role": "lead",
      "dependsOn": ["S1"],
      "inputs": [{ "step": "S1", "output": "plan" }],
      "outputs": [{ "name": "next", "kind": "breakdown" }],
      "waitForChildren": true,
      "iterate": { "from": "S2", "max": 5 }
    },
    {
      "id": "S3",
      "purpose": "Report the outcome of the goal",
      "role": "lead",
      "dependsOn": ["S2"],
      "inputs": [
        { "step": "S1", "output": "plan" },
        { "step": "S2", "output": "next" }
      ],
      "outputs": [{ "name": "report", "kind": "verification" }],
      "waitForChildren": true
    }
  ]
}
