{
  "$schema": "./pattern.schema.json",
  "$comment": "Child tasks are created from your (possibly edited) list when you resume.",
  "id": "goal-plan-gate",
  "name": "Goal, review the plan first",
  "order": 65,
  "description": "Goal that pauses after the plan so you can check or edit the list of child tasks before any of them exists.",
  "whenToUse": "You want to check the list of child tasks before any exists.",
  "extends": "goal",
  "stepOverrides": {
    "S1": { "gate": true }
  }
}
